{
  "plugin_id": "018f7f0a-9c2b-7c31-a101-8b5d7b2f3333",
  "plugin_name": "PRD 拆解技能",
  "plugin_type": "skill",
  "manifest_json": {
    "$schema": "cowork-plugin-manifest-2.0.json",
    "plugin_name": "PRD 拆解技能",
    "plugin_type": "skill",
    "name": "PRD 拆解技能",
    "description": "把需求拆为背景、目标、范围、风险和验收标准。"
  },
  "plugin_json": {
    "$schema": "cowork-plugin-package-2.0.json",
    "attachments": [
      {
        "path": "SKILL.md",
        "content_type": "raw",
        "mime_type": "text/markdown",
        "raw_content": "# PRD 拆解技能\n"
      }
    ]
  },
  "plugin_hash": "sha256:21a4f7c9c7d97d58c44da3d39169cba9fa32500843c9d5189228e8108aa979d3",
  "status": "ACTIVE",
  "created_at": "2026-08-21T08:00:00Z",
  "updated_at": "2026-08-21T08:00:00Z"
}
