{
  "plugin_id": "018f7f0a-9c2b-7c31-a101-8b5d7b2f6666",
  "plugin_name": "WeCom CLI 连接器",
  "plugin_type": "connector",
  "manifest_json": {
    "$schema": "cowork-plugin-manifest-2.0.json",
    "plugin_name": "WeCom CLI 连接器",
    "plugin_type": "connector",
    "name": "WeCom CLI 连接器",
    "description": "通过 CLI 调用企业微信能力。"
  },
  "plugin_json": {
    "$schema": "cowork-plugin-package-2.0.json",
    "connector": { "type": "cli", "source": "connector.wecom-cli" },
    "attachments": [
      { "path": "cli.json", "content_type": "raw", "mime_type": "application/json", "raw_content": "{}" },
      { "path": "skills/wecom/SKILL.md", "content_type": "raw", "mime_type": "text/markdown", "raw_content": "# WeCom\n" }
    ]
  },
  "plugin_hash": "sha256:124b69a0557f5097685a9d521356e1fadab0333bb936a794cc1e8e854a3e742c",
  "status": "ACTIVE",
  "created_at": "2026-08-21T08:00:00Z",
  "updated_at": "2026-08-21T08:00:00Z"
}
